{
  "admission_id": "adm_provider_001",
  "decision": "allow",
  "reason_code": "NEXT_OPERATION_ALLOWED",
  "contract_id": "fixture_provider_connector_proxy_v0",
  "run_id": "contract_run_req_provider_001",
  "step_id": "step_send_provider_message",
  "operation_id": "op_provider_send_message",
  "allowed_connector_id": "provider.connector.v1",
  "allowed_endpoint_ref": null,
  "allowed_method": "POST",
  "constraints": {
    "connector_ref": "telegram.fixture_primary_channel",
    "provider": "telegram",
    "operation": "send_message",
    "side_effect_intent": "external_network"
  },
  "policy_version": "policy.default.v0",
  "expires_at": "2026-05-23T08:35:00Z"
}
